{
  "schema": 1,
  "n": 3,
  "ts": "2026-08-22T13:50:00Z",
  "results": [
    {
      "name": "build",
      "pass": true,
      "exitCode": 0,
      "outputExcerpt": "tsc -b"
    },
    {
      "name": "test",
      "pass": true,
      "exitCode": 0,
      "outputExcerpt": "41 passed"
    },
    {
      "name": "lint",
      "pass": true,
      "exitCode": 0,
      "outputExcerpt": ""
    }
  ]
}
